{
  "@context": [
    "https://www.w3.org/2018/credentials/v1",
    "https://schemas.momentum-sez.org/contexts/msez/v1",
    "https://schemas.momentum-sez.org/contexts/msez/corridor/v1"
  ],
  "id": "urn:msez:vc:corridor-definition:org.momentum.msez.corridor.openbanking.api-based:3d6d9b774952bddc",
  "type": [
    "VerifiableCredential",
    "MSEZCorridorDefinitionCredential"
  ],
  "issuer": "did:key:z6MkiDLLqWJczofc7qVes7pR9cRAiUgkSRpba4iktBaxjqbs",
  "issuanceDate": "2026-02-13T10:51:30Z",
  "credentialSubject": {
    "corridor_id": "org.momentum.msez.corridor.openbanking.api-based",
    "ruleset": "msez.corridor.verification.v1",
    "artifacts": {
      "corridor_manifest": {
        "path": "corridor.yaml",
        "sha256": "3d6d9b774952bddcf05709f7af98a408f246f8092119f8e1db175813cdb50d4c"
      },
      "trust_anchors": {
        "path": "trust-anchors.yaml",
        "sha256": "73dcba9fba6e8e5f4bd6f4a42e862641acbde40d4172fb52b0b501c5cba86a45"
      },
      "key_rotation": {
        "path": "key-rotation.yaml",
        "sha256": "0b6f2a8380a474fe14ffc425d1bf08028d7b99b396188ab3462153fadba3b08d"
      }
    },
    "version": "0.2.0",
    "maintainer": "Momentum SEZ Stack (example key)"
  },
  "proof": {
    "type": "MsezEd25519Signature2025",
    "created": "2026-02-13T10:51:30Z",
    "verificationMethod": "did:key:z6MkiDLLqWJczofc7qVes7pR9cRAiUgkSRpba4iktBaxjqbs#key-1",
    "proofPurpose": "assertionMethod",
    "jws": "Vl8rs2oC08SCwPqegrteQDQK9njYnet9vynhrSc8_VhnF_MnqiP6WkGLqRftQCHEzH2_NDT9UrH7jOSoy3ztDA"
  }
}
