{
  "@context": [
    "https://www.w3.org/2018/credentials/v1",
    "https://schemas.momentum-sez.org/contexts/msez/v1",
    "https://schemas.momentum-sez.org/contexts/msez/corridor/v1"
  ],
  "id": "urn:msez:vc:corridor-definition:org.momentum.msez.corridor.correspondent.baseline:c19d0821448f68ae",
  "type": [
    "VerifiableCredential",
    "MSEZCorridorDefinitionCredential"
  ],
  "issuer": "did:key:z6Mkp8BMuNpEfPPWC4La2djUue1kpwNzEVn1ivpcSythWvqb",
  "issuanceDate": "2025-12-22T00:00:00Z",
  "credentialSubject": {
    "corridor_id": "org.momentum.msez.corridor.correspondent.baseline",
    "ruleset": "msez.corridor.verification.v1",
    "artifacts": {
      "corridor_manifest": {
        "path": "corridor.yaml",
        "sha256": "c19d0821448f68ae8d21d1c4c4bbd4aa3f0ab2c4a3b5ed67d763c729f2e91f91"
      },
      "trust_anchors": {
        "path": "trust-anchors.yaml",
        "sha256": "8fe86b313a40af507fe6d3b834520bab96fca5b0f55bfb70626f21490cc5a512"
      },
      "key_rotation": {
        "path": "key-rotation.yaml",
        "sha256": "127ce61debf3074c6469f33f54acf16ad833c750b62581ccbeb4a79758e7b04e"
      }
    },
    "version": "0.2.0",
    "maintainer": "Momentum SEZ Stack (example key)"
  },
  "proof": [
    {
      "type": "MsezEd25519Signature2025",
      "created": "2025-12-22T00:00:00Z",
      "verificationMethod": "did:key:z6Mkp8BMuNpEfPPWC4La2djUue1kpwNzEVn1ivpcSythWvqb#key-1",
      "proofPurpose": "assertionMethod",
      "jws": "YeI_aRXMdIz43zuYLhE5nMN7gg3NfFeChjHuCueGtJ13CaV3kL6PPjEV9XbiQX-KqCsJbS-jv0Yoa3pfiVGoBg"
    }
  ]
}
